Id;Description;new_description;new_description_str;keywords
3.2.1;Under-5 mortality rate (deaths per 1,000 live births).;['mortality', 'death', 'live', 'birth'];under mortality rate deaths per live births;[['mortality', 'deaths'], ['live', 'births'], ['mortality'], ['births'], ['deaths'], ['live']]
3.2.2;Neonatal mortality rate (deaths per 1,000 live births).;['neonatal', 'mortality', 'death', 'live', 'birth'];neonatal mortality rate deaths per live births;[['mortality'], ['births'], ['deaths', 'live'], ['deaths'], ['neonatal'], ['live']]
3.3.1;Number of new HIV infection per 1000 uneffective population (by age group, sex & Key population);['new', 'hiv', 'infection', 'uneffective', 'population', 'age', 'group', 'sex', 'key'];number of new hiv infection per uneffective population by age group sex key population;[['population'], ['uneffective', 'population'], ['age', 'group'], ['group', 'sex'], ['sex', 'key'], ['hiv', 'infection']]
3.3.2;Tuberculosis incidence per 1000 persons per year.;['tuberculosis', 'incidence', 'person'];tuberculosis incidence per persons per year;[['tuberculosis'], ['incidence'], ['person']]
3.3.3;Malria incidence cases per 1000 persons per year.;['malria', 'incidence', 'case', 'person'];malria incidence cases per persons per year;[['cases', 'persons'], ['cases'], ['persons'], ['incidence'], ['malria', 'incidence'], ['malria']]
3.3.4;Number of new Hepatitis B infections per one lakh population in a given year.;['new', 'hepatitis', 'b', 'infection', 'one', 'lakh', 'population', 'given'];number of new hepatitis b infections per one lakh population in a given year;[['given'], ['population'], ['new'], ['one', 'lakh'], ['lakh', 'population'], ['hepatitis', 'infections']]
3.4.1;Coverage of treatment interventions (pharmacological, psychosocial and rehabilitation and aftercare services) for substance use disorders.;['coverage', 'treatment', 'intervention', 'pharmacological', 'psychosocial', 'rehabilitation', 'aftercare', 'service', 'substance', 'disorder'];coverage of treatment interventions pharmacological psychosocial and rehabilitation and aftercare services for substance use disorders;[['coverage', 'treatment'], ['substance', 'disorders'], ['aftercare', 'services'], ['rehabilitation'], ['services'], ['disorders']]
3.4.2;Harmful use of alcohol, defined according to the national context as alcohol per capita consumption (aged 15 years and older) within a calendar year in litres of pure alcohol.;['harmful', 'alcohol', 'defined', 'according', 'national', 'context', 'caput', 'consumption', 'aged', 'older', 'within', 'calendar', 'litre', 'pure'];harmful use of alcohol defined according to the national context as alcohol per capita consumption aged years and older within a calendar year in litres of pure alcohol;[['older', 'within'], ['context', 'alcohol'], ['consumption', 'aged'], ['years'], ['according', 'national'], ['pure', 'alcohol']]
3.5.1;Number of road traffic fatal injury deaths within 30 days, per 100,000 population (age-standardized).;['road', 'traffic', 'fatal', 'injury', 'death', 'within', 'day', 'population', 'age', 'standardized'];number of road traffic fatal injury deaths within days per population age standardized;[['population', 'age'], ['injury', 'deaths'], ['deaths'], ['road', 'traffic'], ['days'], ['within']]
3.6.1;Percentage of women of reproductive age (aged 15-49) who have their need for family planning satisfied with modern methods.;['woman', 'reproductive', 'age', 'aged', 'need', 'family', 'planning', 'satisfied', 'modern', 'method'];percentage of women of reproductive age aged who have their need for family planning satisfied with modern methods;[['family', 'planning'], ['need'], ['women'], ['reproductive', 'age'], ['age', 'aged'], ['satisfied', 'modern']]
3.6.2;"Adolescent birth rate (aged 10-14; aged 15-19) per 1,000 women in that age group.";['adolescent', 'birth', 'aged', 'woman', 'age', 'group'];adolescent birth rate aged aged per women in that age group;[['age', 'group'], ['aged', 'aged'], ['aged'], ['women'], ['adolescent', 'birth'], ['birth']]
3.7.1;Coverage of tracer interventions (e.g. child full immunization, antiretroviral therapy, tuberculosis treatment, hypertension treatment, skilled attendant at birth, etc.).;['coverage', 'tracer', 'intervention', 'eg', 'child', 'full', 'immunization', 'antiretroviral', 'therapy', 'tuberculosis', 'treatment', 'hypertension', 'skilled', 'attendant', 'birth', 'etc'];coverage of tracer interventions eg child full immunization antiretroviral therapy tuberculosis treatment hypertension treatment skilled attendant at birth etc;[['treatment', 'hypertension'], ['hypertension', 'treatment'], ['therapy'], ['treatment', 'skilled'], ['immunization', 'antiretroviral'], ['full', 'immunization']]
3.7.2;Fraction of the population protected against catastrophic/impoverishing out-of-pocket health expenditure.;['fraction', 'population', 'protected', 'catastrophic', 'impoverishing', 'pocket', 'health', 'expenditure'];fraction of the population protected against catastrophic impoverishing out of pocket health expenditure;[['population'], ['health', 'expenditure'], ['health'], ['fraction'], ['protected'], ['pocket']]
3.8.1;Mortality rate attributed to household and ambient air pollution.;['mortality', 'attributed', 'household', 'ambient', 'air', 'pollution'];mortality rate attributed to household and ambient air pollution;[['pollution'], ['ambient', 'air'], ['air'], ['mortality'], ['household'], ['attributed']]
3.8.2;Mortality rate attributed to hazardous chemicals, water and soil pollution and contamination.;['mortality', 'attributed', 'hazardous', 'chemical', 'water', 'soil', 'pollution', 'contamination'];mortality rate attributed to hazardous chemicals water and soil pollution and contamination;[['water', 'soil'], ['pollution'], ['water'], ['attributed', 'hazardous'], ['contamination'], ['chemicals']]
3.9.1;Age-standardized prevalence of current tobacco use among persons aged 15 years and older.;['age', 'standardized', 'prevalence', 'current', 'tobacco', 'among', 'person', 'aged', 'older'];age standardized prevalence of current tobacco use among persons aged years and older;[['age', 'standardized'], ['years'], ['older'], ['persons', 'aged'], ['tobacco', 'among'], ['among']]
3.10.1;Proportion of the population with access to affordable medicines and vaccines on a sustainable basis;['population', 'access', 'affordable', 'medicine', 'vaccine', 'sustainable', 'basis'];proportion of the population with access to affordable medicines and vaccines on a sustainable basis;[['sustainable', 'basis'], ['access'], ['population'], ['basis'], ['affordable'], ['medicines', 'vaccines']]
3.10.2;Total net official development assistance to the medical research and basic health sectors.;['net', 'official', 'development', 'assistance', 'medical', 'research', 'basic', 'health', 'sector'];total net official development assistance to the medical research and basic health sectors;[['research', 'basic'], ['assistance', 'medical'], ['health', 'sectors'], ['development'], ['health'], ['net', 'official']]
3.11.1;Health worker density and distribution.;['health', 'worker', 'density', 'distribution'];health worker density and distribution;[['density', 'distribution'], ['health', 'worker'], ['health'], ['distribution'], ['density'], ['worker']]
3.12.1;Percentage of attributes of 13 core capacities that have been attained at a specific point in time.;['attribute', 'core', 'capacity', 'attained', 'specific', 'point', 'time'];percentage of attributes of core capacities that have been attained at a specific point in time;[['time'], ['point'], ['specific'], ['attributes', 'core'], ['core'], ['capacities', 'attained']]
4.1.1;"Percentage of children/young people: (a) in grades 2/3; (b) at the end of primary; and (c) at the end of lower secondary achieving at least a minimum proficiency level in (i) reading and (ii) mathematics. Disaggregations: sex, location, wealth (and others where data are available).";['child', 'young', 'people', 'grade', 'b', 'end', 'primary', 'c', 'lower', 'secondary', 'achieving', 'least', 'minimum', 'proficiency', 'level', 'reading', 'ii', 'mathematics', 'disaggregations', 'sex', 'location', 'wealth', 'others', 'available'];percentage of children young people a in grades b at the end of primary and c at the end of lower secondary achieving at least a minimum proficiency level in i reading and ii mathematics disaggregations sex location wealth and others where data are available;[['others', 'available'], ['primary', 'end'], ['level', 'reading'], ['grades', 'end'], ['young', 'people'], ['least']]
4.2.1;Percentage of children under 5 years of age who are developmentally on track in health, learning and psychosocial well-being. Disaggregations: sex, location, wealth (and others where data are available).;['child', 'age', 'developmentally', 'track', 'health', 'learning', 'psychosocial', 'well', 'disaggregations', 'sex', 'location', 'wealth', 'others', 'available'];percentage of children under years of age who are developmentally on track in health learning and psychosocial well being disaggregations sex location wealth and others where data are available;[['years', 'age'], ['health', 'learning'], ['years'], ['others'], ['wealth', 'others'], ['track', 'health']]
4.2.2;Participation rate in organized learning (one year before the official primary entry age).;['participation', 'organized', 'learning', 'one', 'official', 'primary', 'entry', 'age'];participation rate in organized learning one year before the official primary entry age;[['one'], ['entry', 'age'], ['primary', 'entry'], ['organized', 'learning'], ['official'], ['participation']]
4.3.1;Participation rate of youth and adults in formal and non-formal education and training in the last 12 months.;['participation', 'youth', 'adult', 'formal', 'non', 'education', 'training', 'last', 'month'];participation rate of youth and adults in formal and non formal education and training in the last months;[['education', 'training'], ['last'], ['months'], ['non', 'formal'], ['adults', 'formal'], ['participation', 'youth']]
4.4.1;Percentage of youth/adults with information and communications technology (ICT) skills by type of skill.;['youth', 'adult', 'information', 'communication', 'technology', 'ict', 'skill'];percentage of youth adults with information and communications technology ict skills by type of skill;[['communications', 'technology'], ['information'], ['skills'], ['skills', 'skill'], ['technology', 'ict'], ['youth', 'adults']]
4.5.1;Parity indices (female/male, rural/urban, bottom/top wealth quintile and others such as disability status, indigenous people and conflict-affected as data become available) for all indicators on this list that can be disaggregated.;['parity', 'index', 'female', 'male', 'rural', 'urban', 'bottom', 'top', 'wealth', 'quintile', 'others', 'disability', 'status', 'indigenous', 'people', 'conflict', 'affected', 'become', 'available', 'indicator', 'list', 'disaggregated'];parity indices female male rural urban bottom top wealth quintile and others such as disability status indigenous people and conflict affected as data become available for all indicators on this list that can be disaggregated;[['others'], ['top', 'wealth'], ['indigenous', 'people'], ['become'], ['conflict', 'affected'], ['available', 'indicators']]
4.6.1;Percentage of population in a given age group achieving at least a fixed level of proficiency in functional (a) literacy and (b) numeracy skills. Disaggregations: sex, location, wealth (and others where data are available).;['population', 'given', 'age', 'group', 'achieving', 'least', 'fixed', 'level', 'proficiency', 'functional', 'literacy', 'b', 'numeracy', 'skill', 'disaggregations', 'sex', 'location', 'wealth', 'others', 'available'];percentage of population in a given age group achieving at least a fixed level of proficiency in functional a literacy and b numeracy skills disaggregations sex location wealth and others where data are available;[['others', 'available'], ['age', 'group'], ['given'], ['achieving', 'least'], ['fixed', 'level'], ['wealth', 'others']]
4.7.1;Percentage of 15-year-old students enrolled in secondary school demonstrating at least a fixed level of knowledge across a selection of topics in environmental science and geoscience. The exact choice/range of topics will depend on the survey or assessment in which the indicator is collected. Disaggregations: sex and location (and others where data are available);['old', 'student', 'enrolled', 'secondary', 'school', 'demonstrating', 'least', 'fixed', 'level', 'knowledge', 'across', 'selection', 'topic', 'environmental', 'science', 'geoscience', 'exact', 'choice', 'range', 'depend', 'survey', 'assessment', 'indicator', 'collected', 'disaggregations', 'sex', 'location', 'others', 'available'];percentage of year old students enrolled in secondary school demonstrating at least a fixed level of knowledge across a selection of topics in environmental science and geoscience the exact choice range of topics will depend on the survey or assessment in which the indicator is collected disaggregations sex and location and others where data are available;[['level', 'knowledge'], ['across', 'selection'], ['old', 'students'], ['choice', 'range'], ['least'], ['least', 'fixed']]
4.8.1;"Percentage of schools with access to: (a) electricity; (b) the Internet for pedagogical purposes; (c) computers for pedagogical purposes; (d) adapted infrastructure and materials for students with disabilities; (e) single-sex basic sanitation facilities; and (f) basic handwashing facilities (as per the Water, Sanitation and Hygiene for All (WASH) indicator definitions).";['school', 'access', 'electricity', 'b', 'internet', 'pedagogical', 'purpose', 'c', 'computer', 'adapted', 'infrastructure', 'material', 'student', 'disability', 'e', 'single', 'sex', 'basic', 'sanitation', 'facility', 'f', 'handwashing', 'water', 'hygiene', 'wash', 'indicator', 'definition'];percentage of schools with access to a electricity b the internet for pedagogical purposes c computers for pedagogical purposes d adapted infrastructure and materials for students with disabilities e single sex basic sanitation facilities and f basic handwashing facilities as per the water sanitation and hygiene for all wash indicator definitions;[['facilities', 'water'], ['sex', 'basic'], ['materials', 'students'], ['purposes', 'computers'], ['access', 'electricity'], ['basic', 'sanitation']]
4.9.1;Volume of official development assistance flows for scholarships by sector and type of study.;['volume', 'official', 'development', 'assistance', 'flow', 'scholarship', 'sector', 'study'];volume of official development assistance flows for scholarships by sector and type of study;[['development'], ['volume', 'official'], ['assistance', 'flows'], ['study'], ['scholarships', 'sector'], ['official']]
4.10.1;"Percentage of teachers in: (a) pre- primary; (b) primary; (c) lower secondary; and (d) upper secondary education who have received at least the minimum organized teacher training (e.g. pedagogical training) pre-service or in-service required for teaching at the relevant level in the State Disaggregations: sex (and others where data are available).";['teacher', 'pre', 'primary', 'b', 'c', 'lower', 'secondary', 'upper', 'education', 'received', 'least', 'minimum', 'organized', 'training', 'eg', 'pedagogical', 'service', 'required', 'teaching', 'relevant', 'level', 'state', 'disaggregations', 'sex', 'others', 'available'];percentage of teachers in a pre primary b primary c lower secondary and d upper secondary education who have received at least the minimum organized teacher training eg pedagogical training pre service or in service required for teaching at the relevant level in the state disaggregations sex and others where data are available;[['level', 'state'], ['others', 'available'], ['received', 'least'], ['primary', 'lower'], ['secondary', 'education'], ['pre', 'service']]
5.1.1;Whether or not legal frameworks are in place to promote, enforce and monitor equality and non- discrimination on the basis of sex.;['whether', 'legal', 'framework', 'place', 'promote', 'enforce', 'monitor', 'equality', 'non', 'discrimination', 'basis', 'sex'];whether or not legal frameworks are in place to promote enforce and monitor equality and non discrimination on the basis of sex;[['place', 'promote'], ['basis', 'sex'], ['whether'], ['non', 'discrimination'], ['legal'], ['monitor', 'equality']]
5.2.1;Proportion of ever-partnered women and girls aged 15 years and older subjected to physical, sexual or psychological violence by a current or former intimate partner, in the last 12 months, by form of violence and by age group.;['ever', 'partnered', 'woman', 'girl', 'aged', 'older', 'subjected', 'physical', 'sexual', 'psychological', 'violence', 'current', 'former', 'intimate', 'partner', 'last', 'month', 'form', 'age', 'group'];proportion of ever partnered women and girls aged years and older subjected to physical sexual or psychological violence by a current or former intimate partner in the last months by form of violence and by age group;[['years', 'older'], ['age', 'group'], ['form', 'violence'], ['violence', 'current'], ['last'], ['partner', 'last']]
5.2.2;Proportion of women and girls aged 15 years and older subjected to sexual violence by persons other than an intimate partner, in the last 12 months, by age group and place of occurrence.;['woman', 'girl', 'aged', 'older', 'subjected', 'sexual', 'violence', 'person', 'intimate', 'partner', 'last', 'month', 'age', 'group', 'place', 'occurrence'];proportion of women and girls aged years and older subjected to sexual violence by persons other than an intimate partner in the last months by age group and place of occurrence;[['years', 'older'], ['age', 'group'], ['aged', 'years'], ['group', 'place'], ['months'], ['partner', 'last']]
5.3.1;Percentage of women aged 20-24 who were married or in a union before age 15 and before age 18.;['woman', 'aged', 'married', 'union', 'age'];percentage of women aged who were married or in a union before age and before age;[['age'], ['married', 'union'], ['women'], ['aged'], ['married'], ['union']]
5.3.2;Percentage of girls and women aged 15-49 who have undergone female genital mutilation/cutting, by age group.;['girl', 'woman', 'aged', 'undergone', 'female', 'genital', 'mutilation', 'cutting', 'age', 'group'];percentage of girls and women aged who have undergone female genital mutilation cutting by age group;[['age', 'group'], ['women'], ['cutting', 'age'], ['undergone', 'female'], ['female', 'genital'], ['girls']]
5.4.1;Percentage of time spent on unpaid domestic and care work, by sex, age group and location.;['time', 'spent', 'unpaid', 'domestic', 'care', 'work', 'sex', 'age', 'group', 'location'];percentage of time spent on unpaid domestic and care work by sex age group and location;[['time', 'spent'], ['domestic', 'care'], ['work'], ['sex', 'age'], ['group', 'location'], ['care']]
5.5.1;Proportion of seats held by women in national parliaments and local governments.;['seat', 'held', 'woman', 'national', 'parliament', 'local', 'government'];proportion of seats held by women in national parliaments and local governments;[['women', 'national'], ['seats', 'held'], ['held'], ['governments'], ['local'], ['national']]
5.5.2;Proportion of women in managerial positions.;['woman', 'managerial', 'position'];proportion of women in managerial positions;[['woman'], ['managerial'], ['position']]
5.6.1;Proportion of women aged 15-49 who make their own informed decisions regarding sexual relations, contraceptive use and reproductive health care.;['woman', 'aged', 'make', 'informed', 'decision', 'regarding', 'sexual', 'relation', 'contraceptive', 'reproductive', 'health', 'care'];proportion of women aged who make their own informed decisions regarding sexual relations contraceptive use and reproductive health care;[['reproductive', 'health'], ['aged', 'make'], ['make'], ['regarding', 'sexual'], ['women'], ['decisions', 'regarding']]
5.6.2;Number of countries with laws and regulations that guarantee women aged 15-49 access to sexual and reproductive health care, information and education.;['country', 'law', 'regulation', 'guarantee', 'woman', 'aged', 'access', 'sexual', 'reproductive', 'health', 'care', 'information', 'education'];number of countries with laws and regulations that guarantee women aged access to sexual and reproductive health care information and education;[['countries', 'laws'], ['guarantee', 'women'], ['access', 'sexual'], ['aged', 'access'], ['care'], ['education']]
5.7.1;"(a) Percentage of people with ownership or secure rights over agricultural land (out of total agricultural population), by sex; and (b) share of women among owners or rights-bearers of agricultural land, by type of tenure.";['people', 'ownership', 'secure', 'right', 'agricultural', 'land', 'population', 'sex', 'b', 'share', 'woman', 'among', 'owner', 'bearer', 'tenure'];a percentage of people with ownership or secure rights over agricultural land out of total agricultural population by sex and b share of women among owners or rights bearers of agricultural land by type of tenure;[['share', 'women'], ['women', 'among'], ['people'], ['land', 'agricultural'], ['owners', 'rights'], ['land']]
5.8.1;Proportion of individuals who own a mobile telephone, by sex.;['individual', 'mobile', 'telephone', 'sex'];proportion of individuals who own a mobile telephone by sex;[['individuals', 'mobile'], ['telephone', 'sex'], ['individuals'], ['telephone'], ['sex'], ['mobile']]
5.9.1;Systems to track and make public allocations for gender equality and womens empowerment.;['system', 'track', 'make', 'public', 'allocation', 'gender', 'equality', 'woman', 'empowerment'];systems to track and make public allocations for gender equality and women s empowerment;[['make'], ['women'], ['public'], ['systems', 'track'], ['gender', 'equality'], ['gender']]
6.1.1;Percentage of population using safely managed drinking water services.;['population', 'using', 'safely', 'managed', 'drinking', 'water', 'service'];percentage of population using safely managed drinking water services;[['drinking', 'water'], ['water'], ['using'], ['population'], ['safely', 'managed'], ['services']]
6.2.1;Percentage of population using safely managed sanitation services, including a hand-washing facility with soap and water.;['population', 'using', 'safely', 'managed', 'sanitation', 'service', 'hand', 'washing', 'facility', 'soap', 'water'];percentage of population using safely managed sanitation services including a hand washing facility with soap and water;[['population', 'using'], ['soap', 'water'], ['using', 'safely'], ['sanitation', 'services'], ['hand', 'washing'], ['managed', 'sanitation']]
6.3.1;Percentage of wastewater safely treated.;['wastewater', 'safely', 'treated'];percentage of wastewater safely treated;[['wastewater'], ['safely'], ['treated']]
6.3.2;Percentage of bodies of water with good ambient water quality.;['body', 'water', 'good', 'ambient', 'quality'];percentage of bodies of water with good ambient water quality;[['bodies', 'water'], ['water'], ['quality'], ['good'], ['bodies'], ['ambient']]
6.4.1;Percentage change in water use efficiency over time.;['change', 'water', 'efficiency', 'time'];percentage change in water use efficiency over time;[['change', 'water'], ['efficiency', 'time'], ['time'], ['change'], ['water'], ['efficiency']]
6.4.2;Percentage of total available water resources used, taking environmental water requirements into account (level of water stress).;['available', 'water', 'resource', 'used', 'taking', 'environmental', 'requirement', 'account', 'level', 'stress'];percentage of total available water resources used taking environmental water requirements into account level of water stress;[['available', 'water'], ['water', 'stress'], ['water'], ['resources', 'used'], ['account', 'level'], ['taking', 'environmental']]
6.5.1;Degree of integrated water resources management implementation (0- 100).;['degree', 'integrated', 'water', 'resource', 'management', 'implementation'];degree of integrated water resources management implementation;[['degree', 'integrated'], ['management'], ['resources'], ['water'], ['integrated'], ['implementation']]
6.6.1;Percentage of change in the extent of water-related ecosystems over time.;['change', 'extent', 'water', 'related', 'ecosystem', 'time'];percentage of change in the extent of water related ecosystems over time;[['time'], ['change'], ['extent'], ['water'], ['related'], ['related', 'ecosystems']]
6.7.1;Amount of water-and sanitation- related official development assistance that is part of a government coordinated spending plan.;['amount', 'water', 'sanitation', 'related', 'official', 'development', 'assistance', 'part', 'government', 'coordinated', 'spending', 'plan'];amount of water and sanitation related official development assistance that is part of a government coordinated spending plan;[['part'], ['government', 'coordinated'], ['development', 'assistance'], ['spending', 'plan'], ['related', 'official'], ['amount', 'water']]
6.8.1;Percentage of total projects/schemes run and managed by participation of local communities with established and operational policies and procedures for participation of local communities in water and sanitation management.;['project', 'scheme', 'run', 'managed', 'participation', 'local', 'community', 'established', 'operational', 'policy', 'procedure', 'water', 'sanitation', 'management'];percentage of total projects schemes run and managed by participation of local communities with established and operational policies and procedures for participation of local communities in water and sanitation management;[['managed', 'participation'], ['communities', 'water'], ['local'], ['operational', 'policies'], ['projects'], ['procedures', 'participation']]
